Process Tree Structure,Description
"->( X( 'Receive_Order', +( 'Fill_Consolidation_Orders', 'Place_Order_for_Supply_Chains' ) ), ->( 'Confirm_Product_Return', 'Process_Returned_Items' ) )","The initial trigger that sets off the entire process is either the receival of an order or a parallel subprocess. The parallel subprocess consists of the activities 'place order for supply chains' and 'fill consolidation order'. Once the receival of an order or the parallel subprocesses finishes, the focus shifts to handling product returns. For this, the product return has to be confirmed. Once the return is confirmed, the returned items are processed. "
"->( 'Order_Pizza', ->( X( *( 'Cut_Toppings', 'Assemble_Slices' ), 'Design_Pattern' ), ->( 'Bake_Crust', 'Serve_Fresh' ) ) )","Every Process begins when a pizza is ordered. Some pizzas only require designing a pattern before the crust is baked and everything is served fresh, other pizzas require toppings that needs to be cut before the crust is baked and the pizza is freshly served. Rarely toppings need not only to be cut but also followed by an assembly of the topping slices. If the slices need to be assembled then toppings need to be cut again. As soon as all toppings are cut and no further assembling of slices is needed, the curst can be baked and the pizza can be served fresh."
"->( 'Book a meeting', ->( X( 'Prepare a presentation', ->( 'Deliver the presentation', +( 'Set reminders', 'Send notifications' ) ) ), X( 'Gather materials', 'Create handouts' ) ) )","Start by booking a meeting, then prepare a presentation and in the end create handouts or gather materials. Sometimes you already have the presentation prepared and don't need to prepare anymore, then you can deliver the presentation. After the presentation is delivered, set reminders for any follow-up actions (e.g., sending summaries or next steps) and send notifications to attendees or stakeholders as needed. Finally, gather materials or create handouts that will be distributed at the meeting or shared later."
"+( +( 'process', 'optimize' ), ->( ->( 'design', *( 'compile', +( 'generate', 'evaluate' ) ) ), X( 'test', 'validation' ) ) )","Optimization and processing has to be done once but it does not matter when next to the main work. The main work starts with designing. Then compiling the designed code into an executable form. Evaluate the compiled code against a set of predefined criteria or metrics, such as performance, security, or usability. Sometimes the evaluation is done first and then the generation. If generations and evaluations are performed then this leads to a restart of compile. Finally the compiled code is ready to be either validated by a focus group or tested by the developer."
"*( X( 'Create_Report', ->( 'Review_Document', ->( 'Prepare_Proposal', X( 'Analyze_Findings', 'Gather_Data' ) ) ) ), +( 'Schedule_Meeting', +( 'Hold_Video_Call', X( 'Brainstorm_Ideas', 'Invite_Collaborators' ) ) ) )","Sometimes the organization just creates a report and then the process is already finished. In other instances the organization reviews a document and then prepares a research proposal. The proposal then is finalized by analyzing findings  or gathering additional data to be presented. However, sometimes additional information is needed. In this case, a meeting with the professor is scheduled as well as a video call with the project partner is hold. The meeting with the professor and the project partners are independend from each other. Also a decision has to be made about inviting more collaborators with expertise or simply conduct a brainstorming session to gather ideas from the people already involved in the proposal. If additional information is gathered in this way, then the process is kicked off again, i.e. either a report is created or the new document is reviewed etc."
"*( 'Hire Engineer', ->( 'Review Proposal', *( 'Design Blueprint', ->( 'Implement Plan', 'Approve Budget' ) ) ) )","The process starts with hiring an engineer, which either ends the process directly or triggers a review of an proposal by the engineer. Sometimes our engineers review a proposal so that they can design a blueprint afterwards. If the bluebprint involves to hire a new engineer than another engineer is hired and the process could end again or as well trigger the reviewal of a new proposal from the new engineer. If the blueprint does not demand to hiere a new engineer than a plan is implemented which always leads to approvement of the budget. This implementing plan and approving budget procedure than leads back to design blueprint from where the process continues as described."
"*( +( 'Prepare Order', 'Review Payment' ), +( 'Authorize Payment', *( 'Process Refund', *( 'Collect Personal Data', 'Verify Information' ) ) ) )","This process starts by preparing an order and reviewing a payment or by reviewing a payment and preparing an order. Once the initial two steps are completed in any order, the process ends or the focus shifts to authorizing the payment and processing a refund. Here, it does not matter again of the refund is first processed and the the payment is authorized. Now is an interesting part of the process, after the refund is processed, personal data coud be collected and then verfied multiple times. if the verification is not necessary anymore this path of the process goes back to the the processement of the refund. If the payment is authorized and the process is refunded, the entire process starts again. The whole loop can only be stopped after executing the initial two steps reviewing a payment and preparing an order."
"X( X( X( 'Deliver Product', 'Pack Box' ), 'Prepare Inventory' ), X( *( 'Handle Order', 'Process Payment' ), *( 'Ship Package', 'Track Shipment' ) ) )","This process is baded on an e-commerce or logistics-related scenario where multiple activities need to be executed to ensure efficient order fulfillment. The process starts and ends with either delivering a product, or preparing the inventory or packing a box. The process could also start and end directly with handling an order, or shipping a package. However after handling the order a payment could be processed which would retrigger handling an order. Same is valid for shipping a package, this activity could demand tracking of shipments, if this is the case then another package needs to be shipped."
"*( ->( 'Order Products', +( ->( 'Generate Reports', *( 'Pack Orders', 'Verify Inventory' ) ), +( 'Pay Invoices', 'Clear Backorders' ) ) ), *( 'Process Returns', 'Ship Goods' ) )","e-commerce platform that needs to manage orders, inventory, and customer service simultaneously. The iterative workflow begins by ordering new products, then simultaneously many activities are executed, like generate reports, pay invoices and clear backorders. After generating reports, follows pack orders and sometimes additionally verify inventory is performed. If verify inventory is performened, then more orders are packed. Verifing inventory and packing orders can happen multiple times, and can only end after packing orders is done lastly and whenever the invoices are already paid and the backorders as well already cleared. The process usually ends now, but sometimes its required to process returns which triggers the restart of the entire process. Other times processing returns also requires shipping goods, if goods are shipped than more returns have to be processed."
"*( 'Order Package', *( ->( ->( 'Review Invoice', *( 'Create Quote', 'Include Terms' ) ), X( 'Offer Discount', 'Choose Payment Method' ) ), *( 'Send Proposal', *( 'Meet Deadline', 'Gather Requirements' ) ) ) )","The first step involves ordering a package, which is commonly done as the only task of the entire process. However, the full process contains several more steps that are also commonly executed. The process involves reviewing invoices after ordering packages, then creating a quote where terms need to be included. The creation of quotes and inclusion of terms can be done again and again until the final quote is created where then a decision is made between offering a discount or choosing a payment method. From here either the process restarts with order package or a propasal needs to be send. When a proposal is sent an invoice is reviewed again and it continues as described previosly from the review of the invoice or when its urgent, a deadline needs to be meet sometimes this requires to gather requirements on what to achieve. It is possible that several deadlines need to be meet. As soon as a dealine needs to be meet that does not require to gather more requirements, the process restarts with order package."
"*( X( 'prepare order', 'order receipt' ), ->( 'processing start', ->( 'data collection', 'report generation' ) ) )","The following work can be repeated over and over. We have two alternatives to choose from: either 'prepare an order' or 'receive a receipt'. Think of this as a sales workflow where customers can either place a new order (prepare order) or receive a confirmation of their existing order (order receipt). Following, processing starts for an order (either new or existing). This might involve data collection and is followed by generating a report to retrieve customer information, product details, shipping addresses, and so on. We generate a report or output based on the collected data. When the report is generated the entire flow starts again with preparing an order or ordering a receipt. The process can only stops after either a order is prepared or a receipt is ordered. "
"X( X( 'Process Payment', +( 'Verify Card', 'Authorize Transaction' ) ), ->( 'Create Menu', +( 'Prepare Order', 'Pack Goods' ) ) )","The process represents an online food ordering and payment system. Where a customer creates a menu and then the restaurant is preparing an order while also packing goods. The payment system is indepent from the rest and either is solely done by processing a payment or should be shown as simultaneously verifying cards and authorizing transactions."
"X( 'analyze data', *( X( 'develop algorithm', *( 'design model', *( 'generate report', 'execute script' ) ) ), X( 'test software', 'validate results' ) ) )","The process starts with a choice between two alternatives: 'Analyze Data' and a recursive process, where each iteration can involve developing an algorithm or designing a model, or generating a report and executing a script. Another possibility within the recursive process is the testing of software and the validation of results."
"->( +( 'Order Catering', +( 'Deliver Fridge Food', X( 'Choose Guest Arrival Time', X( 'Prepare Food and Cutlery', 'Arrange Delivery' ) ) ) ), +( 'Book Reservation', X( 'Reserve Hotel Room', 'Select Cutlery' ) ) )","This is the top-level process that should visualize different services with a twist. Our specialty is that catering has to be odered first, so that food is delivered to the fridge of the customer, then one out of three decisions can be taken. First decision option is to choose a guest arrival time, the second decision option is to prepare food and cutlery and the third decision option is to arrange a delivery. When all of these steps are done and the decision is made, then and only then a reservation can be booked at our special hotel where the guest either can enjoy a stay at the hotel by reserving a hotel room or the guest can select cutlery to keep the experience as a memory."
"->( *( 'Design Prototype', *( 'Develop Algorithm', 'Integrate New Feature' ) ), +( X( 'Analyze Results', 'Conduct Experiment' ), X( 'Implement Change', *( 'Test Compatibility', *( 'Debug Error', 'Fix Bug' ) ) ) ) )","The goal of this process is to enhance an existing software product by adding new features while ensuring compatibility and quality. The process involves designing a prototype, developing algorithms and integrating new features to the existing software. All of the designing, developing and integrating steps are performed a number of times until finally one group is responsible to analyze improvement results and therefore conduct experiments repeatedly and parallelly another group is responsible for either implementing the changes or testing compatibility, often debugging several errors and fixing various bugs."
"X( X( ->( 'Approve Loan Application', 'Verify Credit History' ), X( 'Send Notification Email', 'Get Customer Information' ) ), 'Initiate Loan Application' )","Our work is simple, everytime we just initiate loan applications or get customer information or send notification emails. Sometimes our work requires a second activity, whenever we need to approve loan applications, we also verify the credit history of our customers."
"X( ->( 'PublishFinalize', 'Review' ), *( 'DesignBook', X( 'CreateConcept', *( 'RefineDesign', 'EditDetails' ) ) ) )","Here, I am going to describe the entire process to publish a book with our agency. First please follow and execute all steps we list in the 'PublishFinalize' step, which includes any necessary formatting, proofreading, or other preparations for publication by yourself. Afterwards a professional review is executed by us. Finally we enter the phase of designing the book, creating a concept, as well as refinining the design and editing the details. We offer to you to do the refinement of the design and the edit of the details until you are satisfied. If after multiple iterations you are still not happy, then we will restart the design of the book with a new designer for you who creates a new concept and again refines the design as well as edits the details as necessary until you are happy with the result."
"X( +( 'Pickup Packages', +( 'Order Menu', 'Deliver Packages' ) ), +( 'Take Order', *( 'Make Food', +( 'Serve Food', 'Prepare Coffee' ) ) ) )","There are two main options to be followed. When following the first main option, you will need to take orders while making food, and sometimes you are also required to prepare coffee and serve food. When following the second main option, you need to pickup a packages from our partners and you are responsible for delivering packages to our customers. During your workday you can order a menu whenever you like."
"->( X( 'Order Product', ->( X( 'Review Invoice', 'Create Purchase Order' ), +( 'Make Payment Package', 'Authorize Transaction' ) ) ), ->( 'Process Claim', X( 'Verify Information', 'Ship Goods' ) ) )","Either order a product or review an invoice or create a purchase order. If you review an invoice or create a purchase order then please authorize the transaction while you also make a payment package. Always and your work by processing a claim and then by deciding to ship goods or verify all information is accurate and complete."
"+( *( 'Capture', *( ->( 'Fetch', 'Generate' ), +( 'Browse', 'Index' ) ) ), ->( 'Dispatch', ->( 'Extract', X( 'Assign', 'Handle' ) ) ) )","Your mate dispatches notifications, extracts relevant information, and assigns or handles it accordingly. Simultanously, you capture, fetch and generate data that is then beeing indexed while also browsed. After indexing and browsing are completed, fetch and generated more data. Either hand over the generated data for indexing and browsing again or otherwise repeat the process at capture data. Finally, continue your work until you have captured enough data. When enough data is capture and all steps from your mate are completed, finish your shift. "
"+( ->( 'Conduct Experiment', ->( 'Analyze Results', 'Collect Samples' ) ), +( 'Prepare Data', 'Summarize Findings' ) )","Per day you will conduct one experiment for laboratory work. The order is crucial here: the experiment must be conducted before analyzing the results, and collecting samples only makes sense after analyzing the results. Somewhere within or outside these three steps another group will summarize the findings from the previous work and another group will prepare data for the next experiment the next day."
"*( X( 'Order Materials', *( 'Pack Furniture', 'Clean Carpets' ) ), ->( 'Assemble Desk', X( 'Bookshelf', 'Edit Documents' ) ) )*","My work can be boring at times. It so happens, that I just need to order materials or pack furniture and thats it. Other times, I am also required to clean carpets after packing furniture and then they ask me to pack even more furniture and clean even more carpets. Only when they think I have packed anough furniture they leave me alone again. What I have described is my daily work. However it also happend several times that after doing my daily work I was put to the task to assemble a desk and then a bookshelf, one time after assembling a desk I even needed to edit documents. And is nothing happend I just returned to my daily work again."
"*( *( 'analyze_samples', *( 'extract_features', 'store_results' ) ), *( ->( 'prepare_data', 'run_analysis' ), *( 'interpret_results', 'present_findings' ) ) )","1. Analyzing individual samples by extracting features and storing results. 2. Preparing data for analysis by cleaning, transforming, or aggregating it. 3. Running parallel analyses on the prepared data to generate insights. 4. Interpreting the results and presenting findings in a meaningful way. 5 present findings with statistics and diagrams"
"*( *( ->( 'SendPackages', 'ProcessReturns' ), *( 'VerifyProductQuality', 'StoreData' ) ), +( 'GetNewStock', 'CreateInvoice' ) ), ->( 'PrepareOrder', 'ManageCustomer' ) )","Start your day always by sending all packages first and then processing the collected returns from the day before. When you are done with all packages, verify the quality of new products that the manager shows to you, sometimes you will need to store all relevant data to a database and verify the product quality for different conditions. On a busy day your work already ends with these tasks. However if you have time then prepare orders and help team A by managing some of their customers. In this case do what you would do for your own customers, i.e. first send packages and then process the returns before doing the product quality verifications and storage of data when necessary. In other cases when you have time and team A does not need assistance get some new stock and create invoices for team B."
"->( 'Prepare Order', +( 'Review Invoice', ->( 'Process Payment', *( 'Pack Item', 'Ship Package' ) ) ) )","The process contains in total 5 activities from beginning to the end with three main parts: order preparation, order processing and shipment. When the order comes, the process starts when the shop owner does 'prepare order'. Afterward there are two parallel processes 'review invoice' and 'process payment'. The invoice is reviewed to ensure all information from customers are correct including quantities of items, prices, special offers, applied taxes, etc. Simultanously, payment is also processed by checking payment method and validation. Following the 'process payment', the item is packed afterwards in box or bag. If there are more items, the current package gets shipped and the next item gets packed."
"*( *( 'Prepare a Proposal', ->( 'Review Contract', 'Sign Document' ) ), ->( 'Send Invoice', *( 'Process Payment', 'Verify Account Balance' ) ) )*","The team starts by preparing a proposal in detail for potential customers. If the customers are interested in the proposal, this results in the team reviewing the contract and signing documents with customers. Then the document is returned to team to prepare again another proposal and continue the process. After all documents are signed and confirmed, then either the process ends, or an invoice is sent to customers to ask for payment process. Occasionally, a verifycation of the account balance is needed, in which case they ask for process payment is reissued. Afterwards, new proposals can be prepared. The process will continue until all proposals are processed with all steps above."
"->( X( *( 'Create', 'Test' ), +( 'Submit', 'Prepare' ) ), ->( 'Develop', ->( 'Conduct', 'Report' ) ) )","- If the resources are not available, process starts with parallel processes Prepare (preparing resources or material needed for the project) and Submit (available materials to authorities or stakeholders) - If the resources are available, process starts with Create the design, report or prototype and then do a test. If anything changes in criteria/alerts during test phase, then return to Create step - Both of two above starting points continue the process with the Develop step which involves refining or elaborating on the created item. Once development is complete, the process moves on to Conduct the tasks (e.g., testing or evaluation) and then does Report for the results."
"X( 'Design System', ->( X( 'Conduct User Testing', 'Define Requirements' ), X( 'Develop Prototype', *( 'Enlist Stakeholder Feedback', ->( 'Finalize Product Specs', ->( 'Harmonize Design Elements', 'Gather User Feedback' ) ) ) ) ) )","This process involves designing a system with several alternative and sequential tasks. It begins with Design System and directly complete the process. Besides, the process provides two alternatives to start: Define Requirements to outline system needs or Conduct User Testing to gather user insights. Next, it offers a choice between Develop Prototype or a nested sequence, then process can be completed. In the nested sequence, Enlist Stakeholder Feedback gathers input from key stakeholders. This is followed by Finalize Product Specs, specifying the system details, leading to Harmonize Design Elements, ensuring consistency. The final step in this path is to Gather User Feedback to validate the design, creating a flexible and comprehensive approach to system development. The nested sequence from Enlist Stakeholder Feedback to Gather User Feedback continues until the feedback is collected as requested. Then the sequence ends up after enlisting stakeholder feedback."
"*( +( ->( 'Order Pizza', +( 'Get Ingredients', 'Fetch Food' ) ), *( 'Prepare Hamburger', 'Cook Chicken' ) ), ->( 'Book Table', +( ->( 'Deliver Dinner', 'Gather Groceries' ), 'Eat Entree' ) ) )","When pizza is ordered (Order Pizza), at the same time staff Get Ingredients and Fetch Food. Concurrent process is to Prepare Hamburger which multiple hamburgers can be prepared and multiple chickens can be cooked. Both two subprocesses can be end up here if the food is taken away. Alternatively, customers can Book Table, where they can Eat Entree (enjoy the food at restaurant) and simultanously, staff Deliver Dinner, arranging meal delivery, then Gather Groceries for upcoming days. This process repeats during the opening time of restaurant."
"->( 'Order_books', *( 'Review_proposals', ->( 'Create_presentation', *( 'Edit_text', 'Finalize_report' ) ) ) )","This describes a day work. I start my day when partners want to order books (Order_books). They also need the our proposals about list of books and their prices. That is why I need to review available proposals (Review_proposals) which aims to evaluate and choose the best options. If partners request to have a presentation, then I create one (Create_presentation) where the outline and main content are developed. This step branches into two concurrent sub-tasks: Edit_text to refine the content and Finalize_report to complete the documentation, ensuring a thorough and well-organized workflow from gathering information to finalizing deliverables. The report will be editted until it is perfect. According to the final report, the proposals will be again reviewed. The process is iterated until the proposals are carefully reviewed"
"*( +( 'Schedule Meetings', ->( 'Send Notifications', X( 'Hold Discussions', 'Conduct Interviews' ) ) ) ), ->( 'Analyze Data', 'Prepare Report' ) )","The main flow is that recruiter Sends Notifications to inform participants about the meetings. After notifications are sent, recruiter needs to Conduct Interviews with candidates. Other work is that he or she needs to Hold Discussions with team about the interviews. Simultanously, Meetings are scheduled. After those subprocesses, recruiter Analyzes Data and then Prepare Report. After report is prepared, the process will restart. The end point is after Holding Discussions or Conducting Interviews."
"X( +( 'Track Package', 'Notify Customer' ), +( 'Verify Order', ->( 'Process Payment', ->( 'Send Invoice', +( 'Receive Return', 'Prepare Shipment' ) ) ) ) )","Whenever any order is in the list, it need to be verified to ensure all details are accurate. Parallel to this is Process Payment, handling the financial transaction. After processing payment, it proceeds to Send Invoice to the customer. This step leads to preparing two parallel tasks: Prepare Shipment for dispatching the order and Receive Return for handling any returned items. Alternatively when order comes, staff needs to Track Package to monitor the shipment's status and Notify Customer at the same time to keep them informed. Those ends up an order and restart when other order comes."
"*( +( 'Send Invitation', X( +( 'Fill Form', 'Prepare Report' ), 'Wait Response' ) ), X( ->( 'Call Meeting', 'Hold Discussion' ), *( 'Conduct Interview', 'Gather Data' ) ) )","When recruiment is requested, invidations for interviews or for events will be sent and simultanously representatives Waits Responses. Another task is to Prepare Report and Fill Form before proceeding any interview or event. Then it ends up process. If it relates to recruiting process, recruiters extend process to Conduct Interview and Gather Data, focusing on collecting detailed information, while the other involves Call Meeting and Hold Discussion sequentially, facilitating planning and decision-making. The extended process restarts with sending invitations until all events or recruitment completed."
