Process Tree Structure,Description
"*( +( 'Design Prototype', X( X( 'Conduct Experiment', 'Evaluate Data' ), 'Develop Algorithm' ) ), ->( 'Finalize Report', 'Prepare Materials' ) )","The process is about designing and developing a new product, which involves prototyping, algorithm development, data evaluation, experimentation, reporting, and material preparation. Design Prototype is concurrent to all later activities, initiating the creation of a preliminary model. In operation, the process offers three options: Develop Algorithm, focusing on creating computational methods, Evaluate Data, which involves analyzing collected data, and Conduct Experiment for testing hypotheses. This can be done. If report is required, then Finalize Report is conducted, where findings are compiled, followed by Prepare Materials, ensuring all necessary documentation and resources are ready. This then repeats the process if new criteria is updated until the design prototype is done, the data is analyzed and experiment is conducted."
"->( ->( 'Oversee Project Meeting', +( 'Conduct Team Review', 'Hold Project Meeting' ) ), *( 'Review Reports', *( 'Review Report Content', X( 'Submit Report', 'Review Report Format' ) ) ) )","This process begins with Oversee Project Meeting, ensuring that the meeting is effectively planned and coordinated. It then progresses to two parallel tasks: Hold Project Meeting to facilitate discussion and Conduct Team Review to evaluate team performance. Following these activities, it transitions to Review Reports, focusing on analyzing and assessing report details. The process usually ends here but sometimes also a detailed review of Report Content is necessary, ensuring accuracy and completeness, then reports are reviewed again with editted contents. After reviewing report content, process is followed by two alternatives: Review Report Format to ensure proper formatting or Submit Report, finalizing the process. Afterward, the report content is reviewed again."
"+( 'publish', +( 'write book', X( +( 'edit chapter', 'design chapter' ), ->( 'publish book', *( 'design header', *( 'format headline', 'headline design' ) ) ) ) ) )","This represents the publication of a book. In the process, Publish is concurrent to all activities, including setting the overall goal of making content available and end of process. The main process is that writer writes a book, where the main content is created. This could completes the process. At the same time, either he or his partner can Designs Chapter for visual layout and Edit Chapter, this could end up the process. The second task in the main process is to publish book. After that, the next step includes Design Header for creating section headings and a following process involving Format Headline to ensure proper structure and headline design for consistency. This step can be proceeded multiple times until all is ready to be publish. Then it fulfills the process."
"+( ->( 'Create Report', ->( 'Conduct Interview', 'Identify Risks' ) ), *( X( 'Estimate Costs', *( 'Design Prototype', +( 'Handle Feedback', 'Gather Requirements' ) ) ), X( 'Finalize Proposal', 'Review Document' ) ) )","This process starts with Create Report, initiating the documentation process. It then moves sequentially to Conduct Interview with experts to gather insights, then Risks are identified to assess potential challenges and process ends up here. Concurrently, financial team Estimates Costs, focusing on financial planning, and technical team Designs Prototype. When both tasks are done then process can be completed or continues with Finalize Proposal to complete the project plan and Review Document to ensure all documentation is thorough and accurate. When those are finished then if any changes regars to Cost or Prototype, team needs to work again on cost estimation and prototype design until those are accepted. For more customer engagement, the process is extended after protoype is designed, then team handle feedback and gather requirements at the same time. If any further decision is made as regards Prototype, then it is demanded to be again designed."
"*( 'Process Customer Order', *( 'Verify Product Availability', +( 'Prepare Shipping Box', ->( 'Process Order', 'Ship Package' ) ) ) )","This process begins with Process Customer Order, handling the initial stages of an order. On Friday the work ends here. On other days, it then moves to Verify Product Availability, ensuring that the requested items are in stock. Afterward, customer orders are again processed or followed by 2 branches. One of that is to Prepare Shipping Box, where workers have to double check the items in the Shipping Box. Besides preparing Shipping Box, workers also Process Order, completing the order procedures, and then Ship Package, ensuring the package is sent to the customer.  if something is missing during Preparing Shipping Box or after Shipping Package, workers need to again verify the product availability."
"->( +( 'Receive Inventory Report', 'Confirm Shipment Details' ), ->( 'Order Goods', +( 'Process Customer Payment', *( 'Package Item', 'Label Package' ) ) ) ) )","Inventory controller have to Confirm Shipment Details, ensuring that all logistics information is accurate and up-to-date. Concurrently, he handles Receive Inventory Report, which provides a detailed account of available stock. Following these steps, he passes list of Order Goods to other team members, where new items are requested from suppliers. This is followed by Process Customer Payment, ensuring that payment transactions are completed successfully. The payment controller completes his task. Concurrently, workers Package Items, which involves preparing the product for delivery, and Label Package, ensuring the package is correctly addressed and ready for shipment. The workers have continuously package items and label packages and end up their daily work at the end of the day or when the orders are out of stock."
"*( 'Review Meeting', X( +( ->( 'Prepare Presentation', 'Obtain Stakeholder Feedback' ), 'Write Report' ), +( 'Assign Task', *( 'Conduct Research Study', 'Analyze Data' ) ) ) )","During the process, the project manager often works with stakeholders or team gathers to assess progress and discuss plans therefore, Reviewing Meeting is prerequisite. If it relates to team meeting, it  involves Assign Task and also Conduct Research Study to gather insights. After Research study is conducted, Analyze Data aims to interpret findings. During analysing data, if lacking data or theoretical review, then repeating the Conduct Research Study. When the tasks are assigned and the loop of conducting research study and analysing data, this process is repeated with Review Meeting. The second task is proceeded in request when data is available, which has to write report for boss, and parallel to Prepare Presentation, then Obtain Stakeholder Feedback, gathering input and approval from key stakeholders. This path also restarts with Review Meeting."
"+( ->( 'Prepare Proposal', 'Hire Candidate' ), X( 'Conduct Interviews', *( 'Review Budget', X( 'Evaluate Options', +( 'Finalize Features', X( 'Develop Design', 'Generate Requirements' ) ) ) ) ) )","During Recruitment Process, Recruiting Team needs to Prepare Proposal, drafting a comprehensive plan, and then Hire Candidate, and completes the process. Concurrently, team Conducts Interviews, gathering important information. Additional task is to Review Budget for the recuitment. This can end up when the Interviews are conducted or budget is accepted. If there are multiple positions and need to make decisions about which options are mostly relevant, then options are evaluated. Also with this case, other member needs to develop design or generate requirements about the job descriptions and all the criteria. The features are parallel finalized. When all are completed, then budget is again reviewed until all criteria is fulfilled."
"->( X( 'Build Prototype', *( 'Gather Feedback', 'Engage Stakeholders' ) ), *( 'Design Product', +( 'Conduct Research', 'Hire Experts' ) ) ), ->( 'Approve Budget', ->( 'Finalize Design', 'Implement Solution' ) ) )","With demand to launch new product or update the product version, Design Product is essential, where the initial concept is created. The design team needs to conduct research and hire experts to complete the final design product. Technical team needs to take care of building prototype (with some initial features or full product designed) and marketing team needs to gather various feedback and engage stakeholders. After all work of those team, a proposal is handed to the boss to get budget approvement, then all teams need to finalize design and implement solution. This completes the process."
" X( 'Conduct Interview', X( 'Review Document', +( 'Plan Meeting', X( 'Schedule Follow-up', 'Send Report' ) ) ) )","When company demands to hire more people. The interviews need to be conducted during the following workload. Recruiters share tasks together. One will Review Document, other schedules follow-up and send report, also simultanously plan meeting. This ends up the process."
"->( ->( 'Prepare Order', ->( 'Check Inventory', *( 'Fill Shipment', 'Fill Shipment' ) ) ) ), X( 'Confirm Shipping', 'Review Payment' ) )","This process model starts with Prepare Order when order is received.Then seller Checks Inventory, ensuring that the required items are in stock. Following this, it branches into the task to Fill Shipment, where the order is packed and prepared for dispatch, and multiple shipments are filled. The follow-up process then need two employees. One will Review Payment, verifying the transaction details, the other will Confirm Shipping, ensuring that the shipment details are accurate and the package is ready for delivery. This ends up the process."
"*( +( 'Create_Presentation', 'Prepare_Report_for_Client' ), X( ->( 'Provide_Feedback_to_Collaborator', 'Review_and_Approve_Document' ), ->( 'Send_Follow_Up_Email_to_Customer', X( 'Follow_up_on_Open_Tickets', 'Schedule_Meeting_with_Stakeholder' ) ) ) )","As a consultant, the daily work is to prepare report for client or create presentation. Those can be done if the customers satisfy with the results. Otherwise, there are two tasks to work on. First task is to provide feedback to collaborator to ask for review and approve documents.The second task is to send follow up email to customers, offering a choice between Schedule Meeting with Stakeholder to facilitate discussions or Follow up on Open Tickets to address pending issues. Both tasks continue with reports and presentations which will be again prepared and handed over again if neccessary or external requests from customer."
"*( 'Interview Candidate', *( 'Hire Manager', +( 'Train Trainer', X( +( 'Evaluate Resumes', 'Hire Committee' ), *( 'Recruit Recruiter', *( 'Screen Applicants', 'Group Interviews' ) ) ) ) ) )","When there is a request to recruit more people, recruiters need to Interview Candidate, who is one of potential new hires. If the candidate is working student or internship with a simple process and candidate reaches all the requirements from department, then the process ends up. When it relates to Hire Manager, where need a precise decision from department, recruiter also arrange to interview candidates. When it involves Train Trainer, which relates to hiring manager request and follow the same flow as described above. Concurrently, if it involves Recruit Recruiter, the applicants need to be screened. Group Interviews are applied. Or if company needs to hire commitee, then resumes are required to be evaluated. This process continues until all the requested positions are filled or end of the day."
"+( ->( 'Fill Order', 'Package and Ship' ), +( 'Prepare Order', ->( 'Review Order', 'Process Payment' ) ) )","This process has two sub processes that run in parallel. The first one is the parallel execution of 'Prepare Order' and the sequence of first 'Review Order' and then 'Process Payment'. The second one is just a 'Fill Order' and then 'Package and Ship'."
"->( 'process_orders', +( 'handle_customer_service', +( X( 'conduct_quality_control', 'manage_inventory' ), *( 'check_order_availability', 'ship_products' ) ) ) )","The process starts with 'process_orders'. Then comes 'handle_customer_service", while simultaneously the following happens: Two sub processes start in parallel. In one, either 'manage_inventory' happens, or 'conduct_quality_control' appears. In the other, 'check_order_availability' is executed. Afterwards, either 'ship_products' happens and then 'check_order_availability' again, triggering a loop, or after the choice of 'manage_inventory' or 'conducty_quality_control' the process ends."
"+( 'Write Report', +( +( 'Make Phone Call', 'Review Documents' ), X( +( 'Create Presentation', 'Analyze Data' ), X( 'Conduct Interview', 'Send Email' ) ) ) )","The process presented here starts with two parallel branches. The first branch contains the activity 'Write Report'. The second branch is the simultaneous execution of two sub branches. The first sub branch is either 'Analyze Data' and 'Create Presentation' in parallel order, or the choice of either 'Send Email' or 'conduct Interview'. The second sub branch is both 'Make Phone Call' and 'Review Documents' in any order. After 'Write Report' and both sub branches, the process terminates."
"+( X( 'Respond to Inquiry', 'Resolve Issue' ), +( 'Process Order', ->( 'Receive Goods', ->( 'Packaging and Shipping', *( 'Prepare Shipping Materials', *( 'Seal Package', 'Label and Ship' ) ) ) ) ) )","For the given process, I need to either respond to an inquiry or resolve an issue. At the same time, I must also process an order and start a chain of activities. This chain consists of receive goods, then packaging and shipping, then prepare shipping materials. After preparing shipping materials, the process can terminate if all of the aforementioned is completed. Or I need to seal the package. I can then return to preparing shipping materials, or I may need to label and ship and then return to seal package."
"*( +( +( 'Confirm with Customer', 'Inspect Order Details' ), 'Receive Order' ), +( X( 'Evaluate Order', 'Cancel' ), +( X( 'Archive Order', 'Notify Customer' ), ->( 'Send Confirmation Email', 'Update Database' ) ) ) )","This is a looping process. It starts with the parallel execution of 'Receive Order' on the one hand and the parallel execution of 'Inspect Order Details' and 'Confirm with Customer' on the other hand. Then either the process terminates, or the following happens. In Parallel, we see the choice of either 'Evaluate Order' or 'Cancel', and the parallel execution of the sequence of 'Send Confirmation Email' and then 'Update Database', and the choice of 'Notify Customer' or 'Archive Order'. In this case, the process loops back to the very beginning, repeating the whole process."
"+( ->( 'Review', 'Prepare' ), +( 'Analyze', X( 'Report', 'Data' ) ) )","This process contains two sub processes that run simultaneously. The first is the parallel execution of 'Analyze' and the exclusive choice of 'Data' or 'Report'. The second is first 'Review', then 'Prepare'. After both sub processes have been finished, the process terminates."
"+( 'Review Reports', +( +( *( 'Create Presentation', 'Finalize Report' ), 'Edit Documents' ), X( 'Analyze Data', 'Download Files' ) ) )","The process at hand consists of four parts. It starts with the parallel execution of the first part (simply 'Review Reports'), and the second part, which again is a parallel execution of the choice of either 'Download Files' or 'Analyze Data', and the third part. The third part is again a parallel execution of simply 'Edit Documents' and the fourth part, which finally is 'Create Presentation' followed by either 'Finalize Report' (forming a loop with 'Create Presentation'), or the termination of the process, should the former parts of the process all have been concluded."
"->( X( ->( 'Design Product', 'Create Prototype' ), 'Receive Order' ), X( +( 'Assess Market', 'Analyze Competition' ), ->( 'Develop Product Features', 'Finalize Product Design' ) ) )","This sequential process starts with of choice of either 'Receive Order' or the sequence of 'Design Product' and 'Create Prototype'. Afterwards, it continues with either 'Assess Market' and 'Analyze Competition' in any order, or with first 'Develop Product Features' and then 'Finalize Product Design'. Afterwards, the process ends."
"X( *( 'Receive Inventory', 'Verify Quality' ), X( ->( 'Ship Products', 'Deliver Goods' ), +( 'Process Payment', ->( 'Order Parts', *( 'Prepare Packaging', 'Label and Tag' ) ) ) ) )","In the current process, we start off with a choice of two sub processes. The first sub process starts with 'Receive Inventory', followed either by 'Verify Quality' which loops back to 'Receive Inventory', or followed by the termination of the process. The second sub process also starts off with a choice. It is either 'Ehip Products', then 'Deliver Goods', then the process ends. Or it is the parallel execution of 'Process Payment' and the sequence of 'Order Parts' and 'Prepare Packaging'. 'Prepare Packaging' can either lead to 'Label and Tag', which calls for a repeated 'Prepare Packaging', or it can lead to the process ending if also 'Process Payment' has been finished."
"X( ->( 'to approve document', X( 'to draft proposal', 'to finalize budget' ) ), *( 'to create document', X( +( 'to brief team', 'to discuss report with stakeholders' ), ->( 'to send email to group about document', ->( 'to notify stakeholders about report', 'to share document with group' ) ) ) )","We start this complex process with a choice. Then it is either 'to approve document', followed by 'to draft proposal' or 'to finalize budget', not both. Then the process would end. Or we would start with 'to create document', after which the process might end or continue. If it continues, we must distinguish between two possible proceedings: Either 'to send email to group about document', followed by 'to notify stakeholders about report', finally followed by 'to share document with group'. Or the execution of 'to brief team' and 'to discuss report with stakeholders' in no particular order. Either way, the process then returns to the task 'to create document'."
"+( 'analyze', ->( +( 'thankYouNote', 'positiveFeedback' ), +( 'escalateToSupport', 'negativeFeedback' ) ) )","This rather simple process begins with 'analyze' and, simultaneously, giving a positive feedback and sending a thank you note. Then, both giving negative Feedback and escalating to support are conducted. Lastly, the process terminates."
"*( 'Buy', X( 'Checkout', *( 'Authorize', +( 'Ship', 'Pay' ) ) ) ) )","The given process starts with 'Buy'. It can then end. Or it can proceed with either 'Checkout', which leads back to 'Buy', or to 'd'. 'd' can, just like 'Checkout', lead back to 'Buy'. Or it can lead to 'Authorize'. This either leads back to 'd', or it is followed by the parallel execution of 'Pay' and 'Ship', after which the process goes back to 'Authorize'."
"->( X( 'Prepare Order', *( 'Review Invoice', 'Process Payment' ) ), X( 'Verify Information', *( 'Validate Data', X( 'Check Consistency', 'Send Notification' ) ) ) )","This process has to major parts, one after another. The first part is as follows: Either I have to prepare an order, or I review an invoice. Depending on the outcome, I may process the payment and return to reviewing the invoice again. The second part is to either verify information (after which the process ends), or to validate data. After data validation the process can end, or it may become necessary to either check consistency or send a notification. After either, the next step would be to validate data again."
"->( *( 'create_product_design', ->( *(  'receive_order_from_customer', 'e' ), *(  'process_payment', 'f' ) ) ), ->( 'prepare_prototype', *( 'design_product', 'test_prototype' ) ) )","I start by creating a product design. Sometimes, I then prepare a prototype, after which I design the product. Sometimes I am finished and that point, but mostly, I test the prototype, after which I get back to designing the product. Other times, after creating the product design, I receive an order from a customer. This might happen several times in a row, with a special step in between that I will just call 'e'. Afterwards, I process the payment, again potentially several times. In that case, a special step called 'f' is required. After processing the payment, I have to start again with creating a process design."
"+( *( 'Fulfill Request', +( 'Process Payment', X( 'Verify Information', 'Authorize Transaction' ) ) ), +( ->( 'Handle Return', 'Ship Package' ), ->( 'Generate Invoice', +( 'Inspect Product', 'Prepare Order' ) ) ) )","I start by both generating an invoice and handling the return. After the handle return, I ship the package. After generating an invoice, I inspect the product and prepare the order, in no particular order. Simultaneously to all of this, I fulfill a request. Sometimes, when all of this is done, I am finished. Other times, I have to process a payment and either authorize a transaction or verify information, then go back to request fulfillment."
"X( 'Verify Information', *( +( 'Create Report', 'Review Document' ), X( 'Analyze Data', 'Summarize Findings' ) ) )I'm excited to interpret Process Tree 1: X( 'Verify Information', *( +( 'Create Report', 'Review Document' ), X( 'Analyze Data', 'Summarize Findings' ) ) )","Either I Verify Information, after which I am done. Or I Create a Report and Review Document in any order. After I have completed both, I am either done, or, depending on the situation, I Analyze Data if I haven't or I Summarize Findings if I have. After this, I go back to Creating a Report and Reviewing a Document."
"+( *( 'Design Report', 'Review Document' ), X( X( 'Conduct Interview', 'Gather Information' ), ->( 'f', 'Create Proposal' ) ) )","For the given process, there are two streams of activities that I run in parallel. One would be to Design Report, potentially requiring Review Document and back to Design Report. This may happen multiple times. The other would be a choice of Conduct Interview or Gather Information or a special activity called 'f', which is always followed by Create Proposal. After both streams of activities have completed, I am done."
"*( 'Order Parts', +( *( 'Assemble Frame', 'Attach Handles' ), +( +( 'Connect Brackets', +( 'Pack Final Product', 'Install Wheels' ) ), 'Unpack Components' ) ) )","Let me start off by saying that the following process can loop several times. I start with Order Parts. In some cases, that is all, and my work is finished. In other cases, there is several things that I must do. I Assemble Frame. This can lead to Attach Handles, which then always means Assemble Frame again. But Attach Handles is optional. I also Unpack Components. This is independent of Assamble Frame and not in any particular temporal order. And I also Connect Brackets, Install Wheels and Pack Final Product in any order I see fit. When these three parts (the Unpack part, the Assemble Frame - Attach Handles part, and the Connect/Install/Pack part) are done, this iteration is complete and I go back repeat the whole process, starting at Order parts."
"->( *( 'Create Proposal for Marketing Campaign', X( 'Marketing Campaign', ->( 'Review and Approval by Manager', X( 'Finalize Sales Strategy', 'Collaborate on Sales Strategy' ) ) ) ), *( 'Develop Sales Strategy', *( 'Conduct Market Research', 'Analyze Results' ) ) )","The process I am going to describe contains several loops. I start with Create Proposal for Marketing Campaign. Following that, I have several options. One is to continue with Develop Sales Strategy, after which the process can end. If it does not end, I follow with Conduct Market Research. After this, I can continue either with Analyze Results, going back to Conduct market Research, which is the first loop. Or after Conduct Market Research, I can instead go back to Develop Sales Strategy, which is the second loop. After Create Proposal for Marketing Campaing I could instead of Developing Sales Strategy go a different route, and either get at Review and Approval by Manager, immediately followed by either Collaborate on Sales Strategy or Finalize Sales Strategy. Or, instead of going to my Manager, I can create a Marketing Campain. After any of these outcomes (Sales Strategies or Marketing Campaign), it is back to Creating a Proposal for Marketing Campaign, whcih is the third loop in the process. The process only ever ends after Develop Sales Strategy."
"*( ->( 'Extract Reports', +( 'Check Invoices', 'Process Payments' ) ), X( 'Analyze Financials', 'Generate Balance Sheets' ) )","We start by extracting reports, then proceed with checking invoices while processing payments, and if we are not finished then, we need to analyze financials or generate balance sheets, before extracting reports again."
"*( +( X( 'Analyze Results', 'Collect Data' ), ->( 'Conduct Interview', 'Write Summary' ) ), *( 'Make Decision', 'Review Report' ) )","How would I describe my process? Okay, let's see. Well, I always start with conducting an interview, to which I then write a summary. At the same time, I have to analyze the results or collect the data, depending on a few factors. Once all of this is completed, often I am done. But there are occasions where I have to make a decision. I start all over again, or I review my report and make a decision again."
